{
  "schema_version": 1,
  "source": "celestrak",
  "fetched_at": "2026-09-27T08:57:39Z",
  "source_url": "https://celestrak.org/NORAD/elements/gp.php?GROUP=stations&FORMAT=json",
  "gp": {"OBJECT_NAME":"ISS (ZARYA)","OBJECT_ID":"1998-067A","EPOCH":"2026-09-27T04:10:50.460096","MEAN_MOTION":15.48664528,"ECCENTRICITY":0.0007168,"INCLINATION":51.6315,"RA_OF_ASC_NODE":155.3455,"ARG_OF_PERICENTER":193.0559,"MEAN_ANOMALY":167.0244,"EPHEMERIS_TYPE":0,"CLASSIFICATION_TYPE":"U","NORAD_CAT_ID":25544,"ELEMENT_SET_NO":999,"REV_AT_EPOCH":58756,"BSTAR":0.00018291,"MEAN_MOTION_DOT":9.528e-5,"MEAN_MOTION_DDOT":0}
}
